[
    {
        "name" : "DriverModulePre",
        "class" : "CommandlineModule",
        "package" : "REDDIEGO",
        "priority" : "-Infinity",
        "startTick" : 0,
        "tickIncrement" : 1,
        "moduleData" : {"config" : "DriverModulePre.json"}
    },
    {
        "name" : "DriverModulePost",
        "class" : "CommandlineModule",
        "package" : "REDDIEGO",
        "priority" : "Infinity",
        "startTick" : 0,
        "tickIncrement" : 1,
        "moduleData" : {"config" : "DriverModulePost.json"}
    },
    {
        "name" : "CommandlineModule",
        "class" : "CommandlineModule",
        "package" : "REDDIEGO",
        "priority" : 0,
        "startTick" : 0,
        "tickIncrement" : 1,
        "moduleData" : {"config" : "CommandlineModule.json"}
    }
]
